<?xml version="1.0" encoding="UTF-8"?>
<tns:Candidate-Details xmlns:tns="http://www.example.org/RecruitingCandidate"
                      xmlns:xsi="http://www.w3.org/2001/XMLSchema-instance"
                      xsi:schemaLocation="http://www.example.org/RecruitingCandidate RecruitingCandidate.xsd">
  <tns:CandidateID>1035</tns:CandidateID>
  <tns:CandidateName>Min-Jun Kim</tns:CandidateName>
  <tns:Candidate-Address>
      <tns:Street>Gangnam Boulevard</tns:Street>
      <tns:LaneNo>127</tns:LaneNo>
      <tns:City>Seoul</tns:City>
      <tns:Pincode>06000</tns:Pincode>
      <tns:Country>South Korea</tns:Country>
  </tns:Candidate-Address>
  <tns:skill>
      <tns:technology>5G Networks</tns:technology>
      <tns:technology>Telecommunications</tns:technology>
      <tns:technology>Network Optimization</tns:technology>
      <tns:technology>Wireless Systems</tns:technology>
  </tns:skill>
  <tns:Annual-Package>1050000</tns:Annual-Package>
</tns:Candidate-Details>